{
  "$schema": "https://json-schema.org/draft/2020-12/schema",
  "$id": "https://folio.local/schemas/types/donut-chart.schema.json",
  "title": "Folio Donut Chart Authoring Input",
  "type": "object",
  "additionalProperties": false,
  "required": ["schema_version", "kind", "title", "segments"],
  "allOf": [{"if":{"properties":{"canvas":{"const":"poster"}},"required":["canvas"]},"else":{"properties":{"height":{"maximum":720}}}}],
  "properties": {
    "schema_version": {"const": "3.0"},
    "kind": {"const": "donut-chart"},
    "title": {"$ref": "#/$defs/non-empty-string"},
    "unit": {"type": ["string", "null"], "maxLength": 12},
    "locale": {"enum": ["en-US", "en-GB", "zh-CN", "zh-TW", null]},
    "source": {"type": ["string", "null"], "maxLength": 256},
    "value_format": {"$ref": "#/$defs/value-format"},
    "segments": {"type": "array", "minItems": 2, "maxItems": 6, "items": {"$ref": "#/$defs/segment"}},
    "focus_segment": {"type": ["string", "null"]},
    "percent_total": {"type": ["boolean", "null"]},
    "tolerance": {"type": "number", "minimum": 0},
    "canvas": {"enum": ["figure", "poster"]},
    "width": {"const": 960},
    "height": {"type": "integer", "minimum": 400, "maximum": 2400, "multipleOf": 4},
    "language": {"$ref": "#/$defs/nullable-string"}
  },
  "$defs": {
    "nullable-string": {"oneOf": [{"type": "null"}, {"$ref": "#/$defs/non-empty-string"}]},
    "non-empty-string": {"type": "string", "pattern": ".*\\S.*", "maxLength": 64},
    "value-format": {
      "type": "object", "additionalProperties": false,
      "properties": {
        "precision": {"type": "integer", "minimum": 0, "maximum": 4},
        "compact": {"type": "boolean"},
        "grouping": {"type": "boolean"},
        "unit_position": {"enum": ["auto", "prefix", "suffix"]}
      }
    },
    "segment": {
      "type": "object", "additionalProperties": false, "required": ["id", "label", "value"],
      "properties": {
        "id": {"$ref": "#/$defs/non-empty-string"},
        "label": {"$ref": "#/$defs/non-empty-string"},
        "value": {"type": "number", "exclusiveMinimum": 0}
      }
    }
  }
}
